Project Status,1st Review,2nd Review,Average Score,Initial Review Notes,Project #,Project Combined,Project Title,Need:,Idea:,Coordinates,Location?,Project Type,Dept.,Who Benefits?,Council District ,Neighborhood
Did Not Advance,10,8,9,,17-442,,Safer biking/walking connections to Burke-Gilman Trail,"Cycling access to major bike paths (Burke Gilman Trail) I difficult and dangerous due to needing to cross or travel along major traffic/high speed roads of 40th, 45th, 50th.   ",Add asphalt paths along roads form 45th to access burke-Gilman Trail ,"47.65607, -122.363","Biking/Walking safe option along 40th, 45th, and 50th",Walkways,SDOT,The community members in Wallingford would be able to better and more safely walk and cycle in the neighborhood.   Also it would enable more cycle commuters to safely use alternative transportation.   ,6,Wallingford
Did Not Advance,10,0,5,Is this UW property?,17-444,,Cleanup Yesler Swamp,There is a terrible problem with waste and litter strewn about.  Pollution impacts both the vitality and the health of our ecosystems and neighborhoods as well as the health of the wild animals which make a home in our urban area.  There should be easily accessible ways for the public to deal with garbage no matter where they live or work.,"More bins for compost, waste and recycling.  Accessibility to bins to prevent waste and decrease litter.  Clear signage addressing proper ways of disposal and informational signage regarding the importance of reducing litter.","47.658980, -122.292472",Yesler Swamp,Park Equipment,UW,"Pedestrians, the general public, wildlife",4,U-District 
Did Not Advance,9,14.5,11.75,,17-445,,Traffic-calming near NE 43rd St and 8th Ave NE,High collision rate at non-arterial residential intersection (5+ collisions in past three years).,"Traffic calming strategy, like traffic circle and/or reduce parking near intersection for increased line-of-sight and maneuverability.","47.659450, -122.319760",Non-arterial intersection at NE 43rd Street and 8th Avenue NE.,Traffic-Calming,SDOT,Pedestrians and vehicle drivers who can avoid collisions at dangerous intersection.,4,U-District
Did Not Advance,14,12,13,,17-446,,Improve ped access to alley between University Way and 15th,"Increased pedestrian and bike use of mid-block connection between alleyways hosting a number of alley-facing businesses, nonprofits, and a preschool, where the intersections are unclear for vehicular and pedestrian traffic both.",Raised or painted crosswalk connecting high-intensity use between alleys hosting a diversity of alley-facing establishments.,"47.659796, -122.313731",Mid-block street crossings on NE 43rd and NE 42nd streets connecting the north-south alley between University Way NE and 15th Avenue NE.,Crossing Improvements,SDOT,"Pedestrians: parents and pre-school children, university students, shoppers, restaurant goers, the homeless; vehicles; and bikes.",4,U-District
Did Not Advance,16,11,13.5,,17-447,,Install lighting and sidewalk repairs near UW,"Near the University of Washington, between 16th and 22nd and 45th and 52nd, there are broken and uprooted sidewalks that are a huge danger to students who live in the area. Beyond that, there are very few streetlights, contributing to the sexual assault problem on campus. Because this area is not in the University's jurisdiction, students are left with dangerous sidewalks and dark streets walking home at night. ",Replace parts of the sidewalks and add street lights to each street.,"47.66126, -122.30953","Near the University of Washington, between 16th and 22nd and 45th and 52nd",Walkways,SDOT,"All students of the University of Washington and the Ravenna area who walk the streets, live nearby, or visit friends.",4,U-District 
Did Not Advance,18,18,18,,17-454,,Improved crossing at Greenlake Way & N. Midvale Ave,"My triangularly-shaped neighborhood, bounded by Aurora Ave. to the West, Greenlake Way to the south and N. 50th street to the north, is hemmed in by busy streets.  Our main access the the post office, shops, schools and cafes of Wallingford is across Greenlake Way.  Greenlake Way has two stoplights that are 1/3 mile apart, so most residents living in the center of the neighborhood take a chance and rush across somewhere in the between these lighted crossings.  Residents of Fremont south of Greenlake Way do the same, heading for Woodland Park, the playing fields, and the Zoo.  Students heading for Hamilton or St. Benedicts also need to cross Greenlake Way.  But that street is a 4 lane highway.  Cars rule,with little respect for speed limits,  and pedestrians take their lives in their hands as they race across between the east-west flow of traffic. We desperately need a pedestrian operated stop light crossing at about  N.Midvale Ave. and Greenlake Way.","We would like to see a safe crossing of Greenlake Way at about N. Midvale Ave. Neighbors feel that a pedestrian-activated crossing, such as is near the Hearthstone Retirement Building north on Greenlake Way or the one on Greenlake Way across from the playing fields at N. 54th would be ideal.  These are similar to the HAWK systems or the Pedestrian Hybrid Beacons.  We don't think a regular stoplight would be good, though, as this might cause more traffic to be diverted through our neighborhoods as drivers seek to avoid it.  ","47.663300, -122.343750",Greenlake Way N. at approximately N. Midvale,Crossing Improvements,SDOT,"All pedestrians traveling from south of Greenlake Way. N. between Stoneway and Aurora Ave.hoping to reach Woodland Park, the Zoo and playing fields safely as well as the residents living the ""The Triangle"" of Greenlake Way N., Aurora Ave. and N. 50th Street who wish to safely walk from their neighborhood to the Postoffice, library, cafes and schools in Wallingford.",4,Green Lake
Did Not Advance,18,18,18,,17-455,,Improved crossing at Greenlake Way & N. Midvale Ave,Traffic speed on Green Lake Way between Aurora Avenue and Stone Way. Excessive traffic speeds results in safety issues for vehicles and pedestrians.,The installation of speed radar signs along this stretch of roadway.,"47.663300, -122.343750",Intersection of Green Lake Way and Midvale Ave. N,Traffic-Calming,SDOT,"Pedestrians trying to cross Green Lake Way  Vehicles traveling on Green Lake Way  Vehicles on connector streets trying to merge onto, or off of, Green Lake Way",4,Wallingford
Did Not Advance,8,7,7.5,,17-457,,Add ADA furniture to Meridian Park,To facilitate use of the park by families and park visitors by adding benches and tables to Meridian Park,Add two ADA accessible tables  and two benches in Meridian Park ,"47.66347, -122.33152",Meridian Park,Park Equipment,Parks,Community members who use Meridian Park ,4,Wallingford
Did Not Advance,18,10,14,,17-460,,Add flashing beacons @ Sand Point Way NE & 50th Ave NE,"I'd like to propose adding cross walk beacons along Sand Point Way NE bordered by 40th Ave NE and and 60th Ave NE. In this section of the city there are multiple crosswalks that enable neighborhood and hospital egress to the Burke Gilman Trail. Frequently cars run red lights at these intersections. In particular, the intersection at 50th Ave NE and Sand Point Way NE is extremely dangerous due to a blind curve on the NE section of the intersection. Motor vehicles have very little time to react to light changes and can be distracted. I am terrified for my daughters life. She is only 2 years old but will soon be riding her bike across the intersection and onto the Burke Gilman Trail. ",Traffic study and evidence based remediation that addresses the results of the study.,"47.668380, -122.274090",50th Ave NE and Sand Point Way NE,Crossing Improvements,SDOT,"Pedestrians, cyclists, families",4,Laurelhurst
Did Not Advance,11,14,12.5,,17-464,,ADA improvements to entrance of Cowen Park,entrance to  Cowen Park is not wheelchair accessible,build paved pathway (or other wheelchair accessible pathway) into Cowen Park at the Brooklyn Av NE/NE Ravenna Blvd entrance,"47.671452, -122.314048",Cowen Park,Accessibility Improvements,Parks,anyone with limited mobility wanting to access the park.,4,U-District
Did Not Advance,12,5,8.5,,17-465,,Add curb ramps to Greenwood & 59th St.,"We live right by the zoo and the playground and yet there are no curb ramps at N 59th St and Greenwood Avenue. People park in front of our house to go to the local restaurants, the park and the zoo. They all have strollers and struggle to get over the curbs. I also have a handicapped mother, so I would love for her to be able to roll her wheelchair to the park and the zoo. Thanks for considering!!",Would love curb ramps!,"47.671860, -122.355360",N 59th St at Greenwood Avenue intersection,Accessibility Improvements,SDOT,Handicapped (my mom as well as the nearby retirement home)  Parents with strollers,6,Phinney Ridge
Did Not Advance,11,12,11.5,,17-466,,Park Improvements at Cowen Park,Cowen Park Shelter isn't used by the neighborhood,Update Cowen Park Shelter or make it easier for the neighborhood association and neighbors to utilize.,"47.671968, -122.313351",Cowen Park,Park Equipment,Parks,Entire Neighborhood,4,Roosevelt
Did Not Advance,11,4,7.5,,17-467,,ADA improvements to entrance of Cowen Park,A dirt path currently leads into the basketball courts on Cowen Park but there doesn't seem to be an entrance to the courts for people in wheelchairs.   ,ADA accessible park entrance - to provide and encourage accessibility  for all members of a community.   Will enrich the neighborhood.,"47.672073, -122.314247",Cowen Park ,Accessibility Improvements,Parks,People in wheelchairs.  Members of  the University district community  ,4,U-District 
Did Not Advance,18,8,13,,17-468,,Crossing Improvements @ 20th Ave N and NE 62nd St,"Cars speeding around blind corner at 20th Ave N and NE 62nd St, at the boarder of Ravenna park and the 20th Ave pedestrian bridge. 20th Ave N is a bicycle boulevard, and 62nd St has bicycle lanes. 62nd St has no sidewalk on the park side of the street. The result is that there are many bicyclists, pedestrians, park-goers, joggers, etc. actually in the street on 62nd. Many cars also use this street to get to 15th Ave NE. Cars routinely speed on 62nd. When turning onto NE 62nd St from 20th Ave NE, there is no stop sign so cars routinely take the corner at high speed. This intersection also receives extraordinarily high bicycle and pedestrian traffic because of the 20th Ave pedestrian bridge, the 20th Ave bicycle path, the 62nd St bicycle path, and the fact that it abuts Ravenna Park. A very simple and inexpensive way to avoid car/pedestrian or car/bicycle accidents would be to add stop signs for all automobiles at this intersection. Because it is a neighborhood, stop signs would not introduce any undue burden on traffic flow.","Please add stop signs for all automobiles at the corner of 20th Ave NE and NE 62nd St, where bicycle traffic, pedestrian traffic, and park-goers are commonly in the street and where cars speed around this blind corner. Stop signs are inexpensive and very easy to install.","47.672640, -122.306500",intersection of 20th Ave N and NE 62nd St,Crossing Improvements,SDOT,"All non-automobile traffic using the 20th Ave bicycle boulevard, the 62nd St bicycle path, the 20th Ave pedestrian bridge, and the northern access to Ravenna park along 62nd St. All of these people are required to be in the street, and would benefit from slowing cars in this same section of street.",4,Ravenna
Did Not Advance,10,15.5,12.75,,17-469,,Crossing Improvements along NE Ravenna Blvd and 8th Ave NE,Safe crossing is needed for pedestrians cutting under the freeway to get to bus stops.,Add crosswalks and paths. Its unclear where the appropriate spot is since people cross willy-nilly everywhere. Assume this is due to no clear safe path.,"47.673510, -122.319670","NE Ravenna Blvd & 8th Ave NE up to NE 64th St & 8th Ave NE and west, under the freeway to Ravenna Blvd where the bus stops are.",Walkways,SDOT,Pedestrians,4,Roosevelt
Did Not Advance,10,13,11.5,,17-471,,Traffic-calming near 63rd St & NE 14th Ave,"The speeding on my street is very dangerous.  I live at 1407 NE 63rd St., 98115.  This is a residential street but is in between some busy streets like 15th Ave NE and Roosevelt Way.  It also parallels NE 65th St.  People cut through, trying to miss the lights on 15th or 65th and well exceed the residential speed limit.  I have three dogs, one child who is nearly 2, and another baby on the way.  I am terrified one of us will get hurt.    I have spoken to many of my neighbors and they all agree, without exception, that the road is out of control and they would like the traffic slowed down and the cutting-through deterred.  Many people on the block have young children, cats, dogs, and others who can easily be hurt by speeding cars down our residential street.    ","I think speed bumps along 63rd and a roundabout on 63rd at the base of 14th, where it meets 63rd, would be a good start.  On 63rd St. just east of 15th Ave (we are just west), the residents actually got the city to make their street one-way, I’m sure to stop the cutting through.  I would also propose our street to be made one-way, running east-to-west, as the dominant speeding traffic is west-to-east, and people seem to race toward 15th Avenue primarily.    I would also like yellow “Residential Street speed limit 20mph” signs posted all over the place.  The street in this stretch is wide and flat and straight, and speed bumps and a roundabout are necessary to physically slow down the traffic as the signs alone will not accomplish this.    I borrowed a Radar gun from the city last September and completed 3 pages of the Radar Gun Data Form and submitted it when I returned the radar gun.  Many cars, well above 15%, WELL exceeded the 20 mph residential speed limit.  People were going 30-35 mph down our street.  I complied with everything the city wanted, but after that, nothing happened.  So I have telephoned several people at the Department of Transportation and the Department of Neighborhoods, as well as my city and county council member and at-large member.  So far, nothing has been done.    ","47.674480, -122.313110",14th Avenue NE and NE 63rd Street,Traffic-Calming,SDOT,"All the residents, and visiting and local children and pets; we also have a good deal of foot traffic, people coming to and from Ravenna Park and many high school students from Roosevelt high walk through the neighborhood.  ",4,Ravenna
Did Not Advance,10,13,11.5,,17-472,,Traffic-calming near 63rd St & NE 14th Ave,"Cars are speeding down the road, often at 35-40 mph, in our residential neighborhood. ","Add in a traffic circle, exactly the same as in place already at 63rd and Brooklyn (1 block away) and 62nd and Brooklyn (2 blocks away). Just a small raised curb island. ","47.674480, -122.313110",The street intersection of 14th Ave NE and 63rd. ,Traffic-Calming,SDOT,"Directly (on a daily basis), all families n the neighborhood including many children. Students at Roosevelt high school also walk on 63rd to get to school. Even residents who walk from further away also pass through this intersection to get to the Whole Foods and other local amenities. ",4,Roosevelt
Did Not Advance,11,13.5,12.25,,17-473,,Crossing improvements to 12th Ave NE & NE 64th st,The intersection crossing 12th Ave NE and NE 64th St is dangerous to pedestrians.  ,I would like to see one of those flashing pedestrian crossing signs like the one on NE 65th St in front of Greenlake Elementary School.,"47.674980, -122.315660",The crosswalk across 12th Ave NE at NE 64th St.,Crossing Improvements,SDOT,All neighborhood pedestrians and Whole Foods shoppers.,4,Roosevelt
Did Not Advance,19,18,18.5,,17-475,,Bioswales along NE 65th St,"NE 65th is a dangerous road, especially at the intersections of 65th & Roosevelt and 65th & 15th. There have been several fatalities along this road, and 50+ bike/ped vs car collisions over the past five years. The street is one lane in each direction, but the lanes are wide, causing drivers to pass each other imprudently and creating an environment in which drivers feel okay speeding. This road has high pedestrian volumes, especially due to nearby Roosevelt High School, but pedestrian safety in this area is not prioritized.   See more information here: http://www.seattlebikeblog.com/2015/07/16/ne-65th-st-is-dangerous-by-design-and-we-know-how-to-make-it-safer-whats-stopping-us/    and here: http://old.seattletimes.com/flatpages/local/pedestrianandbicyclecollisionsinseattle.html","The goal of this project would be to create a park strip/bioswale area, narrowing the lanes of NE 65th between Roosevelt Way and 15th Ave. ","47.675770, -122.311940",NE 65th from Roosevelt Way to 15th Ave,Green Infrastructure,SDOT,Pedestrians in the area (high pedestrian volume from nearby Roosevelt HS),4,Roosevelt
Did Not Advance,14,15,14.5,Need to coordination with WSDOT,17-477,,Improvements to Weedin Place,Not enough lighting in a dark corner of the neighborhood and under the I-5 with some safety issues. This is an area with an increasing number of pedestrians and bikes.,"Add street lighting, or other lighting to illuminate the area after dark.","47.675850, -122.319390",From NE 65th st and Weedin Place north to NE 67th St and following Weedin Place under the highway.,Lighting,SDOT,"An increasing number of apartment dwellers walking, biking, and taking their dogs to greenlake (potentially the nearest greenspace)",4,Roosevelt
Did Not Advance,14,15,14.5,,17-479,,Improvements to Weedin Place,"The intersection of 8th Ave NE and Weedin Pl NE is very dangerous for pedestrians needing to cross the street.  Cars turning north off of 8th Ave NE/Weedin Pl NE (just before they go underneath I-5) onto 8th Ave NE accelerate up the hill without slowing down and checking for people.  The orientation of the streets and poor sightlines make it very difficult for walkers to determine whether cars are continuing along Weedin or turning on to 8th Ave NE, creating a dangerous guessing game and a very hazardous situation.  Furthermore, this area is growing very quickly, with new apartment buildings going up on many blocks.  This will lead to many more pedestrians that need safe street crossings.    For orientation, 8th Ave NE is an arterial that turns into Weedin Pl NE as it turns NW and continues underneath I-5.  8th Ave NE continues as a separate arterial up the hill staying on the east side of I-5.  ","Curb bulbs should be added to east side of 8th Ave NE to ""T-up"" this intersection so that 8th Ave and Weedin Pl meet at a 90-degree angle.  This would force northbound cars on Weedin Pl to slow down to navigate around the curb bulb in order to turn onto 8th Ave NE.  This would also be a great location for a crosswalk across Weedin Pl to connect pedestrians to the 65th Park and Ride and the heavily used bus stops underneath I-5.","47.676580, -122.320050","Intersection of 8th Ave NE, Weedin Pl NE (just before Weedin Pl NE goes underneath I-5.  NOT the short segment of Weedin Pl NE just south of there, though that is also a mess)",Crossing Improvements,SDOT,"People walking and biking around the Roosevelt neighborhood.  Children walking to/from school (Green Lake Elementary, Roosevelt High School, Loyal Heights Elementary at John Marshall building).",4,Roosevelt
Did Not Advance,9,10,9.5,,17-532,,Crossing Improvements @ Northgate Elementary,Beautification and improved safety by Northgate elementary,Painted sidewalks and painted curb bulbs. These would make the area far more cheerful for students walking to school. Colorful curb bulbs/sidewalks could also bring more attention to children walking in the area. ,"47.714070, -122.328270",1st ave ne and 117th st,School Safety,SDOT,"Residents of haller lake, students of Northgate elementary, cyclists using the 117th st overpass. ",5,Haller Lake
Did Not Advance,14,15,14.5,,17-480,,Improvements to Weedin Place,Unsafe intersection that is needed for residents to access public transit. Cars are speeding through intersection on their way up to the freeway entrance.,"Make the area look more pedestrian friendly by painting the street, adding crosswalks, and implementing any other traffic calming device. If paint were continued under the I-5, it could make a dark scary area look much more pedestrian friendly.","47.676580, -122.320050",On 8th Ave NE where NE 66th St and Weedin Place all intersect and go under the I-5 towards Greenlake,Crossing Improvements,SDOT,"Pedestrians walking from high density area to public transit, Pedestrians and bikers going to Greenlake, drivers going to Greenlake or to the I-5 North entrance.",4,Roosevelt
Did Not Advance,14,15,14.5,"Project planned for Weedin Pl NE to be closed to vehicle traffic, NPSF/NMF/OIS project",17-481,,Improvements to Weedin Place,Weedin Pl crosswalks are not well marked ,re-paint and re-orient crosswalks so pedestrians don't wander across the street and motorists know where to stop,"47.676580, -122.320050",Weedin Pl NE (crosswalks spanning NE 65th St and 8th Ave NE),Crossing Improvements,SDOT,"pedestrians, residents, motorists",4,Roosevelt
Did Not Advance,14,15,14.5,,17-482,,Improvements to Weedin Place,There is no safe place to cross a busy and confusing intersection.,Crosswalk - perhaps a raised crosswalk,"47.676655, -122.320112","Intersection of 8th Ave NE, NE 66th St and Weedin Place",Crossing Improvements,SDOT,"Current pedestrians and the hundreds (maybe even a thousand or more) of new residents moving into the new apartment complexes within a couple blocks. Anyone walking between Roosevelt and Greenlake or the Park & Ride, Busses, and Light Rail station.",4,Roosevelt
Did Not Advance,17,12,14.5,,17-483,,"Traffic Calming along 8th Ave NE, near 70th St",Cars speed on a narrow neighborhood road on their way to the I-5 on-ramp. Safety for cars and pedestrians is a concern now and will get worse as the density increases drastically along this corridor.,"Any of these ideas: Curb bulb at south end of 8th Ave NE, speed bumps, make one-way, adjust width, etc.","47.677987, -122.320086",8th Ave NE between NE 67th St and 70th St,Traffic-Calming,SDOT,"Every car taking this route to the I-5 and every pedestrian (existing, and soon to come) walking along this route to get to the bus.",4,Roosevelt
Did Not Advance,18,18,18,,17-484,,Crosswalk Improvement on 62nd Ave NE at  NE 68th St,"Our neighborhood is growing fast!  We need a crosswalk and 2 curb ramps to define a way for pedestrians and pedestrian children to cross 62nd Ave NE.  This street has become the north to south ""highway"" of Magnuson Park Solid Ground Campus, with cars, vans, and trucks avoiding traffic at the two park entrances at NE 65th and NE 74th.  These vehicles will use 62nd NE at high rates of speed right through our residential area.", Install a crosswalk on the north side of 62nd Ave NE at the NE 68th St. intersection.  There are 2 curb ramps already installed but they may need to be brought up to code.,"47.678999, -122.262891",Magnuson Park ,Crossing Improvements,Parks,The general pedestrian public accessing the Park and all residents on the Solid Ground Campus especially school children.  ,4,Magnuson Park
Did Not Advance,14,6,10,,17-488,,Install a traffic circle at 7th Ave NW and NW 70th St,"Cars speed on my road coming off of 8th ave and into a 4-way intersection that has no stop signs (corner of 7th Ave NW and NW 70th St). I witnessed a car vs. motorcycle accident this past summer, and have seen numerous other close calls as cars fail to slow down going through the intersection. There are kids living in the neighborhood as well as lots of foot traffic because of the Barking Dog Cafe, and I'd love to make this spot safer for all. ","I would love to see a traffic circle installed at the intersection of 7th Ave NW and NW70th to match the others on surrounding blocks. In addition to all of the safety benefits it would provide, it would also help to green up the block a bit, and I'd love to get involved with the planting and maintaining of greenery on the circle. ","47.679586, -122.364525",Intersection of 7th Ave NW and NW 70th St,Traffic-Calming,SDOT,"All residents of the block, as well as patrons of the Barking Dog",6,Phinney Ridge
Did Not Advance,18,,18,"Depending upon the location will need to coordinate with Parks & SDOT, inside Magnusen Park, historic overlay district",17-492,With 17-484,Improved crossings around Magnuson Park,"Our neighborhood is growing fast!  We need a crosswalk and 2 curb ramps to define a way for pedestrians and pedestrian children to cross 62nd Ave NE.  This street has become the north to south ""highway"" of Magnuson Park Solid Ground Campus, with cars, vans, and trucks avoiding traffic at the two park entrances at NE 65th and NE 74th.  These vehicles will use 62nd NE at high rates of speed right through our residential area.",Install a crosswalk on the north side of 62nd Ave NE at the NE 68th St. intersection.  There are 2 curb ramps already installed but they may need to be brought up to code.,"47.681770, -122.262270","Magnuson Park, Solid Ground Campus at 62nd Ave NE and NE 68th St.",Crossing Improvements,SDOT,The general pedestrian public accessing the Park and all residents on the Solid Ground Campus especially school children.  ,4,Magnuson Park
Did Not Advance,16,4,10,Sand Point Way NE Study/Vison Zero,17-493,,Build covered batting cage @ Magnuson Park,The Baseball/ Softball area in Magnusson park is unused for half the year due to weather.,Build a covered batting cage in between the Softball and baseball field.,"47.682410, -122.263320",Magnuson Park,Park Equipment,Parks,Anyone interested in Baseball/Softball.,4,Magnuson Park
