Project Status,1st Review,2nd Review,Average Score,Initial Review Notes,Project #,Project Combined,Project Title,Need:,Idea:,Coordinates,Location?,Project Type,Dept.,Who Benefits?,Council District ,Neighborhood
Did Not Advance,0,0,0,,17-130,With 17-128,ADA improvements to play equipment @ Fairmount Playground,"Please, please consider replacing the wood chips that cover the surface of Fairmount Playground in West Seattle with a surface made of rubber to make the park accessible for people with disabilities or any mobility concerns. I have an 8 year old nephew who has Cerebral Palsy and attends Fairmount elementary and he can not play on the playground because of the wood chips. His grandmother, who also has mobility challenges, is also fearful of the wood chips because of their instability.","Removing the wood chips and installing a playground specific rubber surface at Fairmount Playground in West Seattle. It would be wonderful to install a rubber surface to all the parks in the city, and West Seattle especially, with a rubber surface to make the parks accessible for people with disabilities and other mobility concerns. I understand that wood chips are the most economical solution, but quiet frankly, wood chips are unstable and hazardous for people with disabilities and mobility concerns.","47.554733, -122.380516",Fairmount Playground,Park Equipment,Parks,Rubber Playground surfaces make all parks accessible. Playgrounds with wood chip surfaces are not accessible for people with disabilities and mobility concerns.,1,Fairmount Park
Did Not Advance,18,0,9,,17-131,With 17-068,Crossing improvements at 35th Ave & SW Dawson St,"Location: 35TH AVE SW & SW DAWSON ST, SEATTLE, WA  Requesting a marked crosswalk at 35th SW & Dawson SW at entrance to Camp Long. People with children are at risk crossing as is often needed to get to bus or west of 35th walking. Persons needing to cross 35th SW to catch commute buses would benefit. It is like trying to cross the freeway as cars speed through they are unimpeded by the sign saying speed camera in use. I would expect a crosswalk here which besides protecting pedestrians could also be traffic calming.",Install a marked crosswalk at 35th SW entry to Camp Long,"47.555598, -122.376317","35th SW and SW Dawson, entry to Camp Long",Crossing Improvements,SDOT,Persons using camp long who walked from neighborhoods or came on bus and those needing to cross from west side of 35th to east side to catch commute buses,1,West Seattle Camp Long area
Did Not Advance,15,7,11,,17-133,,Open existing gravel road for pedestrian use to link the Delridge neighborhood with Alaska Junction,"There is no safe and direct pedestrian and bicycle connection between the North Delridge neighborhood and Alaska Junction, which is the commercial center of West Seattle. Existing streets lack sidewalks, are indirect, and require steep hill climbs. North Delridge is a lower income portion of West Seattle that lacks basic commercial services such as a grocery store, which makes the need for a connection to the commercial center acute. ","An existing soft-surface (gravel) service road exists on city park property between the West Seattle golf course and Camp Long. If opened for public use, this road would provide a direct link between 29th and Brandon in North Delridge and 35th and Snoqualmie at the edge of Alaska Junction. The grade is gradual enough to be navigated on foot or on a bike while carrying children and is approximately half the distance of currently available routes on city streets. The road itself would require no improvements to be useful as a soft-surface pedestrian and bicycle route. However, both Camp Long and the golf course are closed nightly, so the road would require fencing to allow it to remain open as a transportation corridor after the adjacent parkland has closed. Overhead netting would also likely be required in some places to protect users from golf balls. Existing fences at both ends of the roads would need to be opened. See the following link for google earth photos and a more complete description of the existing road: https://goo.gl/362xzm","47.557851, -122.371494","Existing gravel service road between Camp Long and West Seattle Golf Course, connecting 29th/Brandon to West Seattle Stadium entrance at 35th/Snoqualmie",Accessibility Improvements,Parks,"Residents of North Delridge, which includes many minority/under-represented groups, would get direct pedestrian access to grocery stores and other services, as well as a connection to the RapidRide C line. Bicycle commuters and families cycling with children would have a low-grade, traffic-free connection between the existing 26th Ave Greenway and Alaska Junction. ",1,West Seattle Junction
Did Not Advance,6,14,10,,17-134,,Designate no parking zones adjacent to stairway at SW Edmunds St & 38th Ave SW,Crossing 38th Ave SW at the SW Edmunds St stairs is difficult because parked cars obstruct the curbs.  38th is divided by a steep median. Often the cars are so close together one cannot cross directly to the stairs in the median; you have walk some distance in the street.,Paint no-parking zones on the curbs opposite the ends of the stairs in the median. This is a very low-cost improvement!,"47.559219, -122.379930",The SW Edmunds St stairs at 38th Ave SW.,Signage,SDOT,Many pedestrians who use the stairs.,1,Fairmount Park
Did Not Advance,6,0,3,,17-135,With 17-137,Traffic-calming near 37th Ave SW & SW Edmunds,"Intersection of 37th and Edmunds has a blind spot over a steep hill, and cars frequently divert to 37th to avoid the road diet on 35th, speeding down this residential street with many children and elderly in the neighborhood. We need a speed calming mechanism, like a traffic circle.",Add an elevated traffic circle to the intersection with low maintenance native shrubs.,"47.559250, -122.378830",Intersection of 37th and Edmunds,Crossing Improvements,SDOT,"Community, neighbors, pedestrians, park-and-ride commuters, preschool and Mt. St. Vincent residents.",1,Fairmount Park
Did Not Advance,6,0,3,,17-136,With 17-137,Traffic-calming near 37th Ave SW & SW Edmunds,"Traffic volume and speed on 37th AVE SW between SW Alaska and SW Edmunds.  We now have over 15 kids on our block plus a lot of pedestrians (mostly dog walkers) from the many new nearby apartment buildings in the Alaska junction.  The traffic volume and speed is of great concern for the safety of the neighborhood families and visiting pedestrians (and their dogs) from nearby apartments.  37th does not have parking on both sides, so many delivery trucks, shuttle buses from Providence Mount St. Vincent, fire trucks, etc. utilize the street.  It is a steep hill and cars come racing down blindly at the top of the hill (headed North) where they can't see oncoming traffic or crossing pedestrians.",Traffic circle at intersection of 37th AVE SW and SW Edmunds,"47.559250, -122.378830",intersection of 37th AVE SW and SW Edmunds,Traffic-Calming,SDOT,"Neighbors from increased safety and slower traffic, many dog walkers in the neighborhood from Alaska Junction apartments from increased safety, all vehicles that use this block from increased safety.",1,West Seattle
Did Not Advance,6,8,7,,17-137,,Traffic-calming near 37th Ave SW & SW Edmunds,"Vehicles drive too fast through neighborhood intersection of SW 37th & Edmunds. Families walk in their neighborhood often and have to use extreme caution for vehicles coming up or going down steep hill on 37th. This same street is also offset on one side versus the other of Edmunds, making for multiple driving curveballs that put lives at risk.","- 4-way stop added at currently uncontrolled SW 37th & Edmunds intersection (with preference of strobing, in-sign LEDs)  - traffic circle with embedded amber, blinking caution LEDs  - in-road/recessed amber, blinking LEDs  - pedestrian crosswalk marked on pavement","47.559250, -122.378830",Intersection of SW 37th & Edmunds,Crossing Improvements,SDOT,"Families from this neighborhood walking to nearby parks, schools, shopping, businesses, restaurants, gyms, etc.",1,West Seattle Junction
Not Feasible,,,Not Feasible,No specific location provided,17-802,,Flashing Beacons in South Park,Difficult for seniors and children to cross streets safely.,Install flashing beacons at intersections in South Park.,,South Park,,SDOT,Seniors and children.,1,South Park
Did Not Advance,10,0,5,,17-139,,"Ped improvements @ 5-way Edmunds, California, Erskine Way SW intersection","Need pedestrian and bicycle safety improvements at the 5-way intersection at SW Edmunds Street, California Ave SW and Erskine Way SW. This intersection is one of the major car traffic conduits in West Seattle. It has a drive through bank, car traffic coming from 5 directions and two private parking lots abutting the sidewalks (7-11 parking lot and Uptown Espresso parking lot).Traffic is heavy here make walking and biking beside the intersection, and trying to cross it unsafe and unpleasant. The businesses near this intersection suffer because public parking is not close and it is not at all an inviting place to walk or bike. Pedestrians cannot cross diagonally, but must cross 2 or three streets to get from businesses on the SW side of the intersection to businesses on the NE side of the intersection. The businesses near this intersection suffer because public parking is not close and it is not at all an inviting place to walk or bike. Indeed, there have been repeated failures of businesses at the NE corner of California Ave SW and SW Edmunds Street which I believe can in part be attributed to the uninviting streetscape and the fast cars rushing through the intersection from several directions.  ","Implement crossing improvements and beautification to make the intersection at California Avenue SW, SW Edmunds Street and Erskine Way SW more safe and inviting to people walking and biking. This intersection is one of the major car traffic conduits in West Seattle (aka ""car sewer""). I suggest changing the signal sequence to provide an all-ways walk light cycle similar to the one at the next intersection to the north (California Ave SW and SW Alaska Street). I suggest no turn on red for cars at all entry points to this intersection. I suggest some beautification to make this intersection more inviting to people walking to help improve awareness of businesses at this intersection. Perhaps a parklet on California Ave SW with some kind of interactive or kinetic art installation to draw people to the intersection and encourage them to cross it safely.","47.559320, -122.386870","Intersection of California Ave SW, SW Edmunds Street and Erskine Way SW. ",Place-making/Beautification,SDOT,"The whole community of shoppers and businesses in the West Seattle Junction would benefit from a more inviting, safer intersection. This would attract business to a neglected end of the main business street in West Seattle. People biking would finally a safe and flat route and crossing to navigate from NW West Seattle to South West Seattle.",1,West Seattle/Alaska Junction
Did Not Advance,6,7,6.5,,17-140,,"Install traffic calming infrastructure (speed humps, signage) at the entrance to alleyways running between 42nd Ave SW, SW California Ave, and 44th Ave SW",Drivers are using the alleyways that run between 42nd/California/44th Ave. Our neighborhood needs some traffic signs and calming.    ,"Installing speed bumps in the alleyways and slow signs at the junctions of the alleyways at Genesee, Oregon and Edmunds","47.559337, -122.387097",Edmunds to Genesee mid block running parallel to California Ave/44th/42nd ,Traffic-Calming,SDOT,The entire community,1,West Seattle Junction
Did Not Advance,10,12,11,,17-142,,Crossing improvements near the Duwamish Longhouse,drivers speed along W Marginal Way SW in front of the Longhouse as there are no nearby crossings or traffic lights.,construct a crosswalk in front of the Duwamish Longhouse,"47.560920, -122.352140",W Marginal Way SW in front of Duwamish Longhouse,Crossing Improvements,SDOT,"pedestrians, motorists",1,
Did Not Advance,10,12,11,,17-143,,Improved ped connection to Duwamish Longhouse,"I would like to enjoy events at the Duwamish Longhouse (4705 West Marginal Way SW) but it is very difficult to get there walking or biking. West Marginal Way is a 45 mph five lane freight corridor with no public transportation access and very few safe crossing opportunities for people walking and biking. Sidewalks end two blocks north of the Longhouse, so people walking and biking must walk one half mile between two signals crossing the arterial twice and backtracking to get there. This is so inconvenient it encourages people, including visitors from overflow parking on the opposite side, to cross this busy, wide, high speed arterial unsafely.",Install a pedestrian activated rapid flashing beacon crosswalk between the Duwamish Longhouse and the West Duwamish Trail. This will require coordination with the Duwamish People and the Burlington Northern Railway.   ,"47.560920, -122.352140","Duwamish Longhouse, 4705 West Marginal Way Southwest, 98106",Crossing Improvements,SDOT,"People walking and biking, people using overflow parking at Herring House Park to attend events at the Longhouse across West Marginal Way.",1,
Did Not Advance,10,12,11,,17-144,,Improved ped connetion to Duwamish Longhouse,"I would like to enjoy events at the Duwamish Longhouse (4705 West Marginal Way SW) but it is very difficult to get there walking or biking. West Marginal Way is a 45 mph five lane freight corridor with no public transportation access and very few safe crossing opportunities for people walking and biking. Sidewalks end two blocks north of the Longhouse, so people walking and biking must walk one half mile between two signals crossing the arterial twice and backtracking to get there. This is so inconvenient it encourages people, including visitors from overflow parking on the opposite side, to cross this busy, wide, high speed arterial unsafely.","Install a safe area for walking and biking on the west side of West Marginal Way SW on the two blocks north of the Duwamish Longhouse to connect existing sidewalk with the Longhouse. Maybe this could be done by narrowing down the motorized traffic lanes, carving out streetspace for active transportation modes, and slowing down the speed limit between the Longhouse and Herring House Park.","47.560920, -122.352140","Duwamish Longhouse, 4705 West Marginal Way Southwest, 98106",Walkways,SDOT,"People walking and biking, people using overflow parking at Herring House Park to attend events at the Longhouse across West Marginal Way.",1,
Did Not Advance,6,14,10,,17-148,,Improve crossing at Alaska Ave & Fauntleroy,Timing of the pedestrian crossing signals at SW Alaska & Fauntleroy is too short.,"Increase the pedestrian crossing signal length (especially in the East/West direction along Alaska) by 5-10 seconds. Crossing in this area is difficult for families with children as well as elders who all may cross this wide road more slowly than others. For everyone, since this is a very busy intersection, just the time it takes to look both ways a couple times to avoid red light runners can take up a significant portion of the signal currently.","47.561131, -122.381426",SW Alaska & Fauntleroy intersection in West Seattle,Crossing Improvements,SDOT,"Families from nearby neighborhoods walking to nearby groceries, businesses, restaurants, farmers market, and gyms.",1,West Seattle Junction
Did Not Advance,6,6,6,,17-149,,Improve crossing at Alaska Ave & Fauntleroy,"SW Alaska between Fauntleroy and 35th is dangerous to cross from nearby Edmunds Slope/Fairmount Park neighborhoods since intersections of 36th, 37th, and 38th aren't marked or controlled with pedestrian signals.","- Clearly painted crossings at 36th, 37th, and 38th  - Pedestrian-triggered, blinking crossings at 36th (for easy access to neighborhood YMCA) and 38th (for better access to bus stops and grocery shopping)  - Center, physical bulbs at all crossings to help calm traffic  - Bulb-outs at each intersection to help calm traffic","47.561131, -122.381426",SW Alaska between 35th and Fauntleroy,Crossing Improvements,SDOT,"Neighbors who live nearby that frequently walk with families to nearby YMCA, businesses, restaurants, and transit.",1,West Seattle Junction
Did Not Advance,5,4,4.5,,17-150,,Crossing Improvements @ Alaska Junction,Accessible Crosswalks,Lengthen timers on crosswalks to make it possible for an elderly/disabled person to cross,"47.561468, -122.386657",Alaska Junction AND 42nd & Alaska,Crossing Improvements,SDOT,Elderly/disabled residents nearby,1,Alaska Junction
Not Feasible,,,Not Feasible,No specific location provided,17-803,,Traffic Calming in South Park,Need to slow traffic,Install speed humps,,South Park?,,SDOT,All pedestrians.,1,South Park?
Did Not Advance,5,2,3.5,,17-155,,"Replant trees along 42nd Ave SW, between SW Genesee St and SW Edmunds St","Some trees along California ave, and the streets to its east and west, have died or been removed due to development.  Now they are just stumps.  My idea is to replace these trees and potentially add some more.","Look for opportunities to replace missing trees, and add new ones where possible along the historic commercial area of the West Seattle Junction.","47.564684, -122.385482","From Genesee south to Edmunds SW, along 42nd, California, and 44th Avenues.  (9 blocks)",Place-making/Beautification,SDOT,,1,West Seattle Junction
Did Not Advance,6,10,8,would require SPS coordination,17-156,,Connect walkways near Pathfinder Elementary School.,Access to Pathfinder Elementary School is not walkable for those on the southern end of the geo-zone.  Walking there is a challenge due to poorly maintained sidewalks up Dawson.  Kids are often bused up and around the hill to a school that is relativity close by.,The parks department has spent the last year re-establishing the trail in Puget Park.  Is there a way to connect the trail around Puget Park to the trails behind Pathfinder?  It isn't that far between the two systems of pathways.,"47.565723, -122.396759",Puget Park/Pathfinder Elementary,Walkways,Parks,"K-8 school aged kids south of Puget Park (families along 17-20th avenue) to have walkable access to the school, those traveling any of the trails would have more options to explore as well",1,Puget Ridge
Did Not Advance,8,19,13.5,,17-157,,Add walkway to 19th Ave SW,19th Ave SW on the 5200 block. There are no sidewalks on most of the street. There are a lot of children playing in the roadway and they have to move when there is a car on the road. I think this small block would be greatly improved and be made safer for children if we could just add sidewalks there.,We need sidewalks on this block (19th Ave SW on the 5200 block).,"47.565810, -122.357980",19th Ave SW on the 5200 block,Walkways,SDOT,"Mainly children and the residents there who could actually walk on the sidewalk rather than fighting the cars being driven on that block. Also, it would be more secure because then it would look like the neighbors care about where they live. The sidewalks would make this street look really nice.",1,West Seattle
Did Not Advance,4,11,7.5,,17-158,,Install a traffic circle at intersection of 47th Ave SW and SW Dakota St,It's not clear who has right-of-way and street parking impairs sight-lines.,Install a traffic circle.,"47.566625, -122.392146",47th Ave SW and Dakota St.,Traffic-Calming,SDOT,"Nearby residents. The Seattle Public School District's largest elementary school, Genesee Hill, is located a few block West on Dakota, so this intersection has increased traffic of cars going to and from the school along this street.",1,Genesee Hill
Did Not Advance,14,15,14.5,,17-159,,Traffic-calming & improved lighting near 50th Ave SW,"Not enough street lights in places where kids walk often. No speeding deterrents (i.e. speed bumps, traffic circles etc).   ",Add street lights and speed bumps near high pedestrian areas. ,"47.56665, -122.39614",50th Ave SW and Dakota ,Traffic-Calming,SDOT,Kids watching to Genesee Hill Elementary and Madison middle school and anyone using the parks in the area. ,1,Genesee Hill
Did Not Advance,10,8,9,,17-160,,Add children's play equipment to Dakota Place Park,There is no place for children to play in the West Seattle Junction urban village.,Add some play equipment to Dakota Place Park?,"47.566911, -122.387007",Dakota Place Park,Park Equipment,Parks,Kids.,1,
Did Not Advance,6,12,9,,17-161,,Install a painted curb-bulb @ Yancy & Avalon,Difficult to see cars coming when crossing the street,Install a painted curb-bulb @ Yancy & Avalon,"47.567610, -122.370880",SW Yancy & Avalon Way,Crossing Improvements,SDOT,Pedestrians,1,
Did Not Advance,8,20,14,,17-162,,"Sync traffic signals @ Alki Trail, under WS bridge","The N/S pedestrian/bicycle crossing between Fire Station 36 (at North end of Delridge Path) and the Alki Trail across Spokane and Chelan Streets needs to be modernized - it is unsafe and inefficient in its current configuration. People crossing must push 3 separate crossing buttons and wait for 3 separate light cycles (2 of which involve waiting in paved medians) to cross.  In addition, the crossing buttons are located too far from the curb cuts to be reached by bicyclists without dismounting. Google street views here: https://goo.gl/maps/6LG8gDWTPLx (from Alki Trail), here: https://goo.gl/maps/63ViXroPz1U2 (looking south from first of three crossings), and here: https://goo.gl/maps/UZGsmhJdsVy (looking northwest with all three crossings visible).",Traffic signals should be synced to a single bicycle/pedestrian activation button on the North or South side to allow a full crossing of the roadways. Eliminating the crossing buttons on the center islands will also address the problem that they are too far from the curb cuts.,"47.5712001,-122.3621152","Just west of the Chelan Cafe (3527 Chelan Ave SW), underneath the West Seattle Bridge, where the Alki Trail crosses Spokane and Chelan Streets to access the short path adjacent to Fire Station 36 that leads to Delridge. Map link: https://www.google.com/maps/@47.5712001,-122.3621152,18z?shorturl=1",Other,SDOT,"Pedestrians and cyclists would benefit from a safer, more intuitive, and more efficient crossing. Drivers would benefit in that pedestrians and cyclists would be crossing in a better marked, clearer crossing.",1,North Delridge
Did Not Advance,12,8,10,,17-187,,Install stop signs @ S. Henderson St & 12th Ave S,"There are no stop signs at this intersection and a lot of cars go through, there is SeaMar nursing home nearby, I was involved in a crash right here, and it's uncertain who has the right of way. ",Install stop signs @ S. Henderson St & 12th Ave S,"47.523060, -122.317650",S. Henderson St & 12th Ave S,Crossing Improvements,SDOT,"Nearby residents, families, nursing home visitors and staff, elderly people",1,South Park
Did Not Advance,18,20,19,,17-189,,Improvements to the Duwamish Trail,"Trail is not well lit, looks unkempt, feels unsafe, it's used by drug addicts","Trail improvements (streetlights, clear overgrown vegetation)","47.523115, -122.322970","Duwamish trail, 8th Ave, between S. Trenton St. & Henderson St. ",Walkways,SDOT,"Everyone, especially the youth who uses the trial to walk across the S. Henderson pedestrian overpass from/to the Concord Int. School area.  I feel afraid when my daughter walks through there.",1,South Park
Did Not Advance,4,13,8.5,,17-164,,ADA improvements to intersection fo California & 62nd Ave SW,"Most intersections on the south side of Admiral Way between California Ave SW and 62nd Ave SW are not ADA compliant (no curb cutouts). Sidewalks on SE corner of 62nd Ave SW and SW Admiral Way and between the alley and 63rd Ave SW on the south side of SW Admiral Way are horribly upheaved and make walking hazardous. SW Admiral Way west of California and 63rd Ave SW between SW Admiral Way and Alki Ave SW have many pot holes in the street, so many you could be reporting them all day. This is an inconvenience for cars but can be deadly for people biking. On weekends and sunny evenings, cars ""peel out"" when turning left onto SW Admiral Way from 63rd Avenue SW, making a horrible racket, speeding up the hill to leave Alki threatening people walking and biking and disturbing the peace of people living along these arterials. ","Fix the sidewalks, repave the road on these two arterials (63rd Ave SW between SW Beach Drive and Alki Avenue and SW Admiral Way between 63rd Ave SW and California Ave SW).    There should be DUI traps on the south side of SW Admiral Way (eastbound) somewhere between 63rd and 59th Ave SW on Friday and Saturday nights in the summertime, for people who speed up Admiral hill when leaving the Alki bars.","47.572590, -122.413370",63rd Ave SW between SW Beach Drive and Alki Avenue and SW Admiral Way between 63rd Ave SW and California Ave SW,Traffic-Calming,SDOT,"People walking, biking and living along these arterials.",1,Alki
