Project Status,1st Review,2nd Review,Average Score,Initial Review Notes,Project #,Project Combined,Project Title,Need:,Idea:,Coordinates,Location?,Project Type,Dept.,Who Benefits?,Council District ,Neighborhood
Did Not Advance,20,8,14,,17-753,,Traffic Circle Installation at the intersection of 29th Ave W and Smith St,"The school on 28th Ave W and Smith St. in Magnolia is going to be re-opened and will have little to no parking, causing the surrounding streets to be flooded with auto and foot traffic and cars parking.  There have been multiple accidents at the intersection of 29th Ave W and Smith St. and on two occasions cars have come down the hill and ended up going over the curb and into the yard of the house at 2501 29th Ave W.  A new CVS Pharmacy is being opened at the intersection of 32nd Ave W and Smith St. and it is across the street from Blaine school.  The car and walking traffic up and down Smith St. between 28th Ave W (bus route) and 32nd Ave W on Smith St is excessive and dangerous at crosswalks, etc.  Cars are constantly speeding up and down the hill and do not stop at intersections to look for cross traffic on a regular basis.  Safety needs to be addressed more significantly.  It has been like this for years.",Install a traffic calming circle at the intersection of 29th Ave W and Smith St in Magnolia and curb ramps for people with disabilities from 28th Ave W to 32nd Ave W on Smith St; along with better parking signage.,"47.641170, -122.394180",Install a traffic calming circle at the intersection of 29th Ave W and Smith St in Magnolia and curb ramps for people with disabilities from 28th Ave W to 32nd Ave W on Smith St; along with better parking signage.,Traffic-Calming,SDOT,"Residents, foot traffic (many of whom are school children at Blaine School and will be new students at the school reopening at 28th Ave W and Smith St.) and automobile traffic through this area.  ",7,Magnolia
Did Not Advance,20,8,14,,17-754,,"Traffic-calming along Smith St, near 28th Ave W","On Smith St cars speed between 30th Ave W and 28th Ave W. Also, there are no curb cuts/ramps for wheelchairs/people with mobility issues anywhere on Smith St between 32nd Ave W and 28th Ave W. This will be a huge problem in 2018 when the old Magnolia School is reopened and traffic flow and pedestrian travel will increase significantly on this street.","We need a traffic calming circle at the intersection of Smith St and 29th Ave W. This will help deter speeding cars from Smith St, and funnel them to W McGraw, one block south, which is already an arterial street. We will also need signage indicating no parking within 30 ft of each intersection, to help protect visibility and children at street crossings. Finally, we need curb ramps on at least one side of Smith St from 32nd Ave W to 28th Ave W (new ones on 29th, 30th, and 31st Ave's W).","47.641307, -122.394892",Smith Street between 28th Ave W and 32nd Ave W,Traffic-Calming,SDOT,"Students attending the newly opened (2018) Magnolia School on 28th Ave W, students attending Catherine Blaine school on 34th Ave W, people walking to Magnolia Village and the playfields near Magnolia Village, and nearby residents who will be affected by increased parking and traffic in 2018.",7,Magnolia
Did Not Advance,12,12,12,,17-755,,Traffic Calming on Warren Ave N at Queen Anne Driv,It is scary to cross QA Drive due to car speed.  This is an arterial with cars coming to and from I-99.  Cars traveling eastbound towards I-99 round a blind corner arriving at arterial speeds to this crossing.  In the winter this intersection is very dark.,Make a 4-way stop (currently a two-way stop) and add a cross walk.,"47.641880, -122.354490","Warren Ave N at Queen Anne Drive, with crosswalk across east side of Warren Ave N on QA Drive.",Crossing Improvements,SDOT,Pedestrians and bicyclists would benefit.  Warren Ave is the safest crossing available for the east side of Queen Anne Ave.  This is the best access to Mayfair Park on QA and if traveling by bike to Fremont from the east side of QA.,7,Queen Anne
Did Not Advance,4,6,5,,17-756,,Traffic-calming near 8th Ave W & Halladay,Cars speed on our street using it as an arterial.  Very unsafe with children walking to Coe Elementary.  A traffic circle at the corner of 8th Avenue West and West Halladay Street would help alleviate this issue.,A traffic circle at the corner of 8th Avenue West and West Halladay Street would help alleviate this issue.A traffic circle at the corner of 8th Avenue West and West Halladay Street would help alleviate this issue.,"47.64203, -122.36759",Street intersection -- 8th Avenue West and West Halladay Street,Traffic-Calming,SDOT,"Children walking to school, children at play, and the many daily community members walking and running on our street.",7,Queen Anne
Did Not Advance,4,6,5,,17-757,,Construction of a traffic circle at 8th Avenue West and West Halladay Street ,Cars speed on our street using it as an arterial.  Very unsafe with children walking to Coe Elementary.  A traffic circle at the corner of 8th Avenue West and West Halladay Street would help alleviate this issue.,A traffic circle at the corner of 8th Avenue West and West Halladay Street would help alleviate this issue.A traffic circle at the corner of 8th Avenue West and West Halladay Street would help alleviate this issue.,"47.642052, -122.367561",Street intersection -- 8th Avenue West and West Halladay Street,Traffic-Calming,SDOT,"Children walking to school, children at play, and the many daily community members walking and running on our street.",7,Queen Anne
Did Not Advance,14,20,17,,17-758,,Improved crossing at N. Queen Anne Dr. & 4th Ave N,"Through a busy, confusing, 7-way intersection, pedestrians, including children on their way to school, must navigate steep sidewalks, narrow sidewalks without ADA ramps, and areas where vehicle drivers cannot clearly see them.","Add curb bulbs, ADA ramps, improved crosswalks, and modify landscaping to provide visible and safe passage for pedestrians. Initial studies have been done by QA Greenways and as part of SDOT Report 16-025, December 2016","47.643000, -122.349550",7-way intersection at N Queen Anne Drive and the west side of 4th Avenue N,Crossing Improvements,SDOT,Children and staff walking on 4th Ave N to Seattle Country Day School and pedestrians in general walking east on N Raye Street to or under the Aurora Bridge,7,Queen Anne
Did Not Advance,12,20,16,,17-760,,Crossing improvements at W Queen Anne Dr and 4th Ave N,"On the north end of Queen Anne, a 7-way intersection, leading to and from the SR99 Aurora Bridge, presents a confusing challenge for drivers, pedestrians and a Safe Route to School. So many drivers arrive at the intersection simultaneously that it is very difficult for them to view and assess all the possibilities and make safe decisions. Pedestrians, especially children going to school, get lost in this process.","In the recent past the upper portion of W Raye Street has been made one-way away from the intersection, reducing the number of vehicles entering the decision process. We believe that applying that same logic to upper QA Drive on the west side of the intersection, as studied in SDOT Report 16-025, December 2016, would have the same positive effect. In addition, adding a sidewalk ramp treatment at upper QA Drive would greatly increase the safety of pedestrians using the steep 4th Avenue N sidewalk, especially in rainy weather.","47.643000, -122.349550",West Queen Anne Drive and 4th Avenue North,Crossing Improvements,SDOT,"Pedestrians, including children walking to the Seattle Country Day School, would have a safe sidewalk all the way down the steep 4th Avenue N hill to the intersection at Queen Anne Drive. All vehicle drivers would benefit from having one less decision point to assess before entering the intersection, simplifying the traffic flow and reducing the possibility of collisions.",7,Queen Anne
Did Not Advance,2,17,9.5,"Coordination with Parks & SDOT, Olmsted Boulevard",17-762,,Add walkway along Fulton St. & improve crossing @ 8th Ave W.,There is no walking path or curbs on a critical street that allows people to walk to Queen Anne neighborhood core and Coe School. People walk in the street and compete with vehicles in the narrow street up and down the hill.,Add a sidewalk and curbs where they are missing. Provide a better marked crosswalk on a busy corner.,"47.645890, -122.367570",West Fulton Street & 8th Ave West,Walkways,SDOT,"Queen Anne residents, Queen Anne students, & Seattle Pacific University Students.",7,Queen Anne
"On Ballot, Not Funded",14,16,15,,17-763,,Crosswalk Installation on Nickerson Street & Dravus Street,"Very dangerous crossing of Nickerson Street, which poses a major obstacle between the community of North Queen Anne and the Shipping Canal, its trail, and commercial properties. There is an existing crossing that would benefit greatly from improvements, as there are few other crossings within a reasonable distance.","Please refer to the SDOT study and findings presented in the NSF report 2016-117.  With over 11,000 vehicles per day and approximately 90 pedestrians crossing per hour, this location corresponds with 8-A in the report and per the SDOT recommendations, this intersection warrants the installation of an RRFB system along with a raised median island to replace the existing flexible markers. Furthermore, the addition of curb bulbs into the parking lane would reduce the crossing distance, increase visibility, and decrease motor vehicle speeds in the vicinity of this existing neighborhood crossing.   ","47.648690, -122.355310",Nickerson Street & Dravus Street,Crossing Improvements,SDOT,"All ages and abilities including residents, patrons of the businesses, employees of the commercial offices and anyone needing to cross this location.  It is particularly important to improve visibility for this crossing during the dark, rainy months of the year.  ",7,Queen Anne
Did Not Advance,4,8,6,,17-764,,Traffic-calming on 26th Ave W.,cars speed on my road,speed bumps,"47.648988, -122.389671","3200 block of 26th Ave West, north of Dravus",Other,SDOT,all the families that live on our block - including nearly 20 children under the age of 10 who are not allowed to get near the street since people fly through here at 40mph.,7,Magnolia
Did Not Advance,4,8,6,,17-767,,"Traffic-calming on 26th Ave W, near Dravus",Cars speed frequently on our street. There are a number of young (<5 y.o.) children on the street with cars speeding through to apartments on the next block. ,"Ideally, speed bumps would be great. ","47.65031, -122.38976",26th Avenue W; 3200 block between Dravus and Bertona,Traffic-Calming,SDOT,Child safety.,7,Magnolia
Did Not Advance,4,8,6,,17-768,,Replant 6 trees along 28th Ave W,"There are 6 half dead trees on the planting strip by Magnolia Manor Park that need replacing.  As they are mostly dead there is a safety issue with falling branches, plus it looks as if Seattle doesn't care about how street trees look.",Get 6  new replacement trees.  We have volunteers who are willing to plant the trees if the city provides them.  We can also help with watering after the new trees are planted.,"47.651506, -122.392859","3500 block of 28th Ave West, on the east side of the street.",Green Infrastructure,SDOT,"Everybody who lives in the area, which is the most densely populated area of Magnolia.  Many people have commented to Friends of Magnolia Manor Park that the trees need replacing.",7,Magnolia
Did Not Advance,12,10,11,,17-769,,Traffic Calming / Pedestrian Visibility Improvements,Speeding vehicles and the refusal to top for pedestrians attempting to cross the street. Bus stops on either side of street are not safe to utilize because of the issues. ,Cross walk marking. Radar speed sign.,"47.657680, -122.400910",34th Ave W & W Elmore St,Traffic-Calming,SDOT,Neighborhood residents. All people walking this route to Discovery Park.,7,Magnolia
Not Feasible,,,Not Feasible,"As a policy, SDOT doesn't do this? // Not SDOT policy",17-008,,Add no truck parking signs to Dallas Ave S,"Cars speeding, lack of adequate crosswalks and trucks (tractor trailers & truck cabs) parking throughout residential areas in the neighborhood.","Constant truck parking on Dallas Ave S. Trucks decrease visibility on the street, idle and cause emissions and block light into people’s homes along Dallas Ave.   a.	NO TRUCK PARKING signage would solve this. ","47.519390, -122.315010","Throughout South Park Neighborhood (Dallas Ave S, 14th Ave & W Marginal Place S)",Signage,SDOT,Residents and visitors to the South Park neighborhood. Business owners are working to revitalize our commercial corridor and traffic calming measures would be a great help!,1,South Park
Not Feasible,16,17,16.5,"All-way stops should not be installed since this 14th/16th is an arterial and is just south of a bridge. This is also a major truck street route, so traffic calming measures were taken off the table when the road was re-vitalized along with the south park bridge ",17-009,,"Improve 5-way intersection @ Dallas, 14th Ave & W. Marginal Way","Cars speeding, lack of adequate crosswalks and trucks (tractor trailers & truck cabs) parking throughout residential areas in the neighborhood.",	A traffic calming mechanism is much needed at a FIVE WAY intersection with no lights or stop signs at Dallas Ave S and Thistle. There is a large business with over 100 employees & cars at this corner and it is a pedestrian pathway from the bus on 14th. There have been several near-miss incidents on this corner.  The business owner is very neighborhood friendly and might even consider helping to cover costs if approached.  a.	Simple stop signs would make this MUCH SAFER. ,"47.519390, -122.315010","Throughout South Park Neighborhood (Dallas Ave S, 14th Ave & W Marginal Place S)",Traffic-Calming,SDOT,Residents and visitors to the South Park neighborhood. Business owners are working to revitalize our commercial corridor and traffic calming measures would be a great help!,1,South Park
Not Feasible,,16,16,"All-way stops should not be installed since this 14th/16th is an arterial and is just south of a bridge. This is also a major truck street route, so traffic calming measures were taken off the table when the road was re-vitalized along with the south park bridge ",17-010,With 17-011,Traffic-calming @ 14th Ave S & Dallas S,"Cars speeding, lack of adequate crosswalks and trucks (tractor trailers & truck cabs) parking throughout residential areas in the neighborhood.",	A traffic calming mechanism is much at the intersection of 14th Ave S & Dallas Ave S. This is a VERY dangerous intersection right after the South Park Bridge.   a.	Maybe a flashing sign or lit crosswalk? Speed humps could be helpful as wel,"47.519390, -122.315010","Throughout South Park Neighborhood (Dallas Ave S, 14th Ave & W Marginal Place S)",Traffic-Calming,SDOT,Residents and visitors to the South Park neighborhood. Business owners are working to revitalize our commercial corridor and traffic calming measures would be a great help!,1,South Park
Not Feasible,16,17,16.5,"All-way stops should not be installed since this 14th/16th is an arterial and is just south of a bridge. This is also a major truck street route, so traffic calming measures were taken off the table when the road was re-vitalized along with the south park bridge ",17-011,,Crossing improvement at 14th Ave S & Dallas Ave S,"Rapid-flashing crosswalk at a dangerous intersection where cars are coming over the South Park Bridge. People run across the street here, which is very dangerous as cars are just coming off of E Marginal Way and over the South Park Bridge, meaning they are slowing down from going fast, but not slow enough. There are already curb ramps here, we are asking to add a painted crosswalk with pedestrian-activated RRFB so these speeding cars see this crosswalk easier. A constant blinking sign is not desired, as people get used to these over time.","RRFB (Rectangular Rapid Flashing Beacon) combined with IRWL (In Roadway Warning Lights), painted crosswalk","47.519390, -122.315010",14th Ave S and Dallas Ave S - south crossing from west to east/east to west,Crossing Improvements,SDOT,"Pedestrians, bicyclists, drivers",1,South Park
Not Feasible,16,17,16.5,"All-way stops should not be installed since this 14th/16th is an arterial and is just south of a bridge. This is also a major truck street route, so traffic calming measures were taken off the table when the road was re-vitalized along with the south park bridge ",17-012,,Improve intersection of 14th Ave S & Dallas Ave S,A traffic calming measure is necessary at the intersection of 14th Ave S & Dallas Ave S. This is a VERY dangerous intersection right after the South Park Bridge.     ,"A flashing sign, a lit crosswalk, or speed bumps could be helpful.","47.519390, -122.315010",14th Ave S & Dallas Ave S in South Park.,Crossing Improvements,SDOT,"All neighbors and visitors in South Park, business owners along 14th Ave S, #60 bus users who catch the bus on 14th Ave S, and all vehicles and trucks that pass over the SP bridge.",1,South Park
Not Feasible,,,Not Feasible,"Benches need an annual permit, not a city asset",17-138,,Add a bench to the viewing area at SW Edmunds & 28th Ave W,There is a place with a very nice view but no bench for people to sit and enjoy the view. ,Puting a bench there. ,"47.559252, -122.377684",SW Edmunds St & 36th Ave SW on the northwest side of the intersection.,Park Equipment,SDOT,Everyone who stumbles upon this very nice view. ,1,West Seattle
Not Feasible,,,Not Feasible,Not public ROW,17-141,,Upgrade public passageway from California Ave SW to the alley between SW Alaska St and SW Edmunds St ,The passage way from California Ave to the alley (where people park) at the mid-point between Alaska and Edmunds is delapidated.,"Upgrade the walls, ceiling, floor, and lighting to make the passage way safer and more inviting.  Replace the public art.","47.560173, -122.386828",The passage way starts on California Ave. and goes to the alleyway to the west.  It is located midway between Alaska and Edmunds street.,Accessibility Improvements,SDOT,,1,West Seattle Junction
Not Feasible,,,Not Feasible,Public space management work,17-152,,"Landscape medians along 39th Ave SW, near Oregon St.",Need more garden plots,Find landscape medians of certain size on residential streets to turn into garden plots,"47.563651, -122.381433",West Seattle...one street n of West seattle bowling alley,Green Infrastructure,SDOT,All,1,
Not Feasible,,,Not Feasible,"No traffic lights, over budget limit, need to coordinate with school plan",17-166,,Improve entrance/exit to West Seattle High School,Lots of traffic at the start and end of school w/ only two exits that are not controlled by an signal leading to large backups and dangerous turns being made with lots of people walking.,Add a traffic signal - setting up two new traffic signals at the entrances/exits of the WS parking lot. ,"47.57611, -122.38504",West Seattle High School Entrance/Exit,School Safety,SDOT,"Student, parents, staff, school visitors who drive to the school and pedestrians walking in the Admiral area.",1,Admiral
Not Feasible,,,Not feasible,King county property - outside of city limits,17-17,,Complete missing link of Green River Trail connecting to South Park,"Cars speeding, lack of adequate crosswalks and trucks (tractor trailers & truck cabs) parking throughout residential areas in the neighborhood.",Safely connect the green river trail to South Park along W Marginal Place S. It’s impossible to safely bike/walk/run along the Green River Trail from South Park without risking being hit by a fast moving car.  ,"47.520736, -122.314877","Throughout South Park Neighborhood (Dallas Ave S, 14th Ave & W Marginal Place S)",Walkways,King County,Residents and visitors to the South Park neighborhood. Business owners are working to revitalize our commercial corridor and traffic calming measures would be a great help!,1,South Park
Not Feasible,,,Not Feasible,Fire signal,17-175,,Install a crosswalk and lights at the intersection of California & Walker,"Intersection of California and Walker is dangerous for pedestrians crossing, especially at night.",Install a crosswalk and lights at the intersection.,"47.58401, -122.38644",California and Walker,Crossing Improvements,SDOT,Pedestrians,1,Admiral
Not Feasible,,,Not feasible,King County Property,17-18,,Complete missing link of Green River Trail connecting to South Park,Limited pedestrian and bicycle connectivity routes into or out of South Park.,"Completing the missing segment to link South Park to the Green River Trail. The current route puts pedestrians and runners on W Marginal Way S, a highly trafficked road with no shoulder or sidewalk, until Cecil Moses Memorial Park. It is very risky here.","47.520736, -122.314877",W Marginal Way S between Cecil Moses Memorial Park and 14th Ave S.,Walkways,King County,"All users of the Green River and Duwamish River Trails, whether on foot or bike, as well as those who work in the large office developments adjacent to this area.",1,South Park
Not Feasible,,,Not Feasible,"Overbudget, needs extensive outreach process",17-186,,Bicycle lane along 14th Ave S.,"South Parks main core looks semi-abandoned, many businesses boarded up and dirty, a dedicated bike lane (well lit at night) will beautify the street and will encourage people to ride their bikes. ",Bicycle lane along 14th Ave S.,"47.523040, -122.314960","On 14th Ave, between Dallas Ave S. and S. Henderson St.",Walkways,SDOT,All the community at large,1,South Park
Not Feasible,,,Not Feasible,Would require coordination with ST // Coordination with ST & SDOT underway,17-188,,Improve crossing @ RB Lightrail Station,It takes too long to cross the street at the Rainier Beach Light Rail Station.  People end up crossing against the light all of the time.  ,Add a crossing at the other end of the platform with a pedestrian activated signal.  ,"47.523280, -122.279000",Rainier Beach Light Rail Station,Crossing Improvements,SDOT,Everyone who uses the rainier beach light rail station.,2,Rainier Beach
Not Feasible,,,Not Feasible,Coordination with ST & SDOT underway,17-191,,Addressing illegal ped crossing near light rail,improve safety via slowing street traffic and  dissuading pedestrians from crossing MLK Way S illegally ,"""Increase frequency of stop light signal changes""","47.523280, -122.279000",intersection of S Henderson St and MLK Way S (Rainier Beach Link light rail station),Crossing Improvements,SDOT,"pedestrians, residents, commuters",2,Rainier Beach
Not Feasible,,,Not Feasible,"Major arterial, emergency route",17-194,,Traffic calming on Henderson,There are too many cars speeding on this very busy throughway.  ,"Installing speed bumps, stop signs, flashing beacons, or traffic circles to slow the flow of traffic in this area and bring attention to pedestrians.","47.523361, -122.264629",Henderson and Seward Park to Henderson and MLK,Traffic-Calming,SDOT,Both drivers and pedestrians,2,Rainier Beach
Not Feasible,,,Not Feasible,Full signal exists,17-197,,Add a flashing beacon to 14th Ave S. and Trenton St. (NW to NE),"A lot of people go to SeaMar community clinic located on the NE corner of the at intersection.  A flashing beacon would make pedestrians more visible, as this is the busiest road in the neighborhood, used by cars, commercial trucks, etc. ",Add a flashing beacon to 14th Ave S. and Trenton St. (NW to NE),"47.524750, -122.314940",14th Ave S. and Trenton St. (NW to NE),Crossing Improvements,SDOT,Especially those who go to SeaMar Clinic and Pharmacy,1,South Park
Not Feasible,,,Not Feasible,Too expensive,17-200,,Install a playground @ Cesar Chavez Park,"Kids living west of the Hwy 99 overpass don't have access to a playground structure, and teh Cesar Chavez park remains underused since it was open",Install a playground @ Cesar Chavez Park,"47.526501, -122.325500",Cesar Chavez Park,Park Equipment,Parks,"Kids and their parents, to socialize",1,South Park
Not Feasible,,,Not Feasible,Has been reviewed in the past and found too expensive to construct to SDOT standards,17-206,,"Crosswalk installation on East Marginal and 16th Avenue, leading to South Park bridge.",There is no safe way to cross the street at East Marginal and 16th Avenue. There are no sidewalks or crosswalks and this is a five lane highway.,"Install multiple crosswalks and stoplights, or at least pedestrian activated lights.","47.534240, -122.313120","East Marginal and 16th Avenue, leading to South Park bridge.",Crossing Improvements,SDOT,Anyone wanting to connect Georgetown to South Park. ,2,Georgetown
Not Feasible,,,Not Feasible,"Overbudget, needs extensive outreach process",17-210,,"Create a bike lane along S. Cloverdale, from South Park to Roxbury",No safe way to get from White Center to South Park,"Create a bike lane along S. Cloverdale, from South Park to Roxbury","47.535818, -122.333973","S. Cloverdale, over I-99 bridge",Other,SDOT,Bicyclists ,1,South Park
Not Feasible,,,Not Feasible,Requires community input.  Consider Neighborhood Matching Fund. ,17-212,,Build parklets in Othello neighborhood,address the lack of well-lit public spaces within the community,"""Design and installation of parklets within the District 2 area""","47.53703, -122.2834",along 39th Ave. S near the grocery store and women's shelter,Place-making/Beautification,SDOT,"clients of the women's shelter, residents, shoppers, pedestrians",2,Othello
