Project Status,1st Review,2nd Review,Average Score,Initial Review Notes,Project #,Project Combined,Project Title,Need:,Idea:,Coordinates,Location?,Project Type,Dept.,Who Benefits?,Council District ,Neighborhood
"On Ballot, Not Funded",18,16,17,,17-006,,Trail improvements @ Roxhill Park,"Trail improvements at Roxhill Park - violence and danger in park, drug use, public intoxication ",Improve lighting and trim trees around trails .. Interpretive trail improvements ,"47.51775, -122.36925",Roxhill Park,Walkways,Parks,"neighbors, Westwood Village, and city of Seattle ",1,South Delridge
"On Ballot, Not Funded",20,20,20,,17-014,,"Improve 5-way intersection @ Dallas Ave S, 12th Ave S, and Thistle St","A traffic calming mechanism is much needed at a FIVE WAY intersection with no lights or stop signs at Dallas Ave S, 12th Ave S, and S Thistle St. There is a large business with over 100 employees & cars at this corner and it is a pedestrian pathway from the bus on 14th. There have been several near-miss incidents on this corner. ",Simple all-way stop signs; adding stop signs or yield signs. Perhaps even a roundabout. Adding crosswalks (with flashing lights) to multiple corners since it's an odd intersection. Adding a dedicated bike lane as well because a lot of cyclists go through here daily.,"47.519390, -122.315010","Dallas Ave S, 12th Ave S, S Thistle St",Crossing Improvements,SDOT,"The neighbors who live at this intersection (some feel they are in danger of having a car come through their window), the neighbors who use Dallas Ave as a thoroughfare to enter and exit South Park's waterfront, the business owner and employees of the company that is currently expanding at this intersection. Many of us have witnessed accidents and confusion here. ",1,South Park
Funded for 2018 Implementation,16,16,16,,17-019,,Busstop improvements on Barton St,"The ""Delridge Bus Triangle"" located at 9200 Delridge Way, is an SDOT managed property in the heart of the Westwood Highland Park Residential Urban Village. This public right of way is fraught with hiding places for intravenous drug use, drug dealing, prostitution and illegal dumping right along the heavy commuter driven Delridge Way corridor.  Delridge is unsafe to cross at this natural central location. This area has a high pedestrian inter-connectivity between pending Delridge H Rapid Ride line to the east, and the Westwood Village Transit mall at Roxbury Park to the west along Barton Street SW.","We have already created a ""Friends of the Delridge Bus Triangle"" committee, in partnership with SDOT. We held our first meeting on Jan 28th, 2017 to document the history, needs and collective vision of the space. That document can be found here: https://docs.google.com/document/d/1WbNyNKrp7B3TAM4S_uBV6g2NK3bN-wELv97QLfSB4ak/edit","47.520934, -122.358290","9200 Delridge Way SW, cross streets are Barton STREET SW to the north, and 18th Ave SW to the east. ",Other,SDOT,"Everyone living in along the South Delridge Corridor, with particular benefit to the marginalized, at-risk children that live in the densely populated area immediately east of this space. ",1,South Delridge
"On Ballot, Not Funded",15,18,16.5,,17-031,,Crossing Improvement along SW Henderson St,"Improve crossings along SW Henderson St at 12th, 13th, or 17th Ave SW","A clearly marked cross walk and parking restrictions near the curb would be a start to helping to increase visibility for cars as well as pedestrians.   Extending the curbs, however, would make a huge difference.   This would allow cars on Henderson to far more easily see pedestrians who are trying to cross on their way to and from school. ","47.522840, -122.351640",Henderson & 13th Ave SW 98106,Crossing Improvements,SDOT,Pedestrians and drivers alike.  The neighborhood benefits by an increase in safety and walkability.,1,Highland Park
Funded for 2018 Implementation,20,17,18.5,,17-044,,Improved crossings on S. Cloverdale ,"S Cloverdale St is a busy road and 12th Ave S was identified in South Park's Open Space plan as a secondary improved walking/bike route. We would like to increase the safety for pedestrians to cross Cloverdale at 8th, 10th, or 12th Ave S; Cars speed through a vital intersection in neighborhood. It's near a freeway entrance and it's an arterial but pedestrians must cross this particular street to access neighborhood offerings; Safer crossing on cloverdale in South park to the elementary school.","Crosswalks on S. Cloverdale at 8th Ave S, 10th Ave S. and/or 12th Ave S. for pedestrians to cross safely with a high vis sign alerting drivers to the possibility of pedestrians; Speed bumps, crosswalks, and wheelchair accessibility.  Sidewalks and planter strips ;Light up crosswalks. ","47.526450, -122.320230","S. Cloverdale at 10th Ave S and 12th Ave S. Skate Park, South Park Meadow Dallas and 12th Ave S, Cloverdale and 5th Ave s.",Crossing Improvements,SDOT,The entire neighborhood ,1,South Park
"On Ballot, Not Funded",14,18,16,,17-068,,Crossing improvements at 35th Ave & SW Dawson St,"Safer ped crossing @ 35th Ave SW to Camp Long, near SW Dawson St ","A crosswalk at the intersection of 35th Ave SW and SW Dawson Street (the entrance to Camp Long), including an island in the median.","47.555598, -122.376317",The intersection between 35th Ave SW and SW Dawson Street in West Seattle,Crossing Improvements,SDOT,"Children, community members and nature-lovers who use Camp Long and live in the surrounding area.",1,West Seattle
Funded for 2018 Implementation,17,17,17,,17-085,,Add sidewalks to S. Sylvan Way,To make the community safer.  It's a residential area and kids take the bus and some walk to school.  There is also a sharp curve and cars drive fast.  Its really unsafe.,Add sidewalks to S. Sylvan Way,"47.537744, -122.362418",S. Sylvan Way,,SDOT,People walking,1,High Point
"On Ballot, Not Funded",18,20,19,,17-235,,"Walkway improvements on 4th Ave S, between E. Marginal Way & Michigan","The sidewalk is missing on the part of 4th Ave S between East Marginal to 4th Ave S between Michigan. This area is where residents walk to access the food bank at St. Vicent de Paul on 4th Ave S. It is where students from SSCC walk to get lunch at a variety of restaurants. Employees from our local industrial community have also complained that accessing food in this area is dangerous. There are many cars that have been run off the road purely because you can't tell where the street or parking lot begins or ends. Street trees would also be needed to reduce noise and air pollution. When a sidewalk with street trees are in place, the walk for residents and employees to access food would become safe and beautiful.","We need drainage, sidewalks, curbs and street trees.This has been supported in the past by a grant that was given to the Georgetown community then taken away. I was told we needed drainage, so we got nothing instead.","47.545360, -122.329630",4th Ave S between East Marginal way and Michigan.,Walkways,SDOT,"Residents accessing the local food bank, employees accessing lunch and students accessing lunch would benefit from safe sidewalks and street trees. Drivers would benefit by having safe roads and businesses could actually provide safe parking.",2,Georgetown
Not Feasible,16,19,17.5,,17-145,,Install painted crosswalk at SW Alaska St. and 38th Ave SW,"The intersection of SW Alaska and 38th Ave SW is a very congested intersection for both vehicles and pedestrians that would benefit both by having a marked North-South crosswalk.    Transit  On the northwest corner of the intersection there is the C Line Rapid Ride stop. With the fairly recent addition of new apartments (Link, Spruce) and the current addition of more (Whittaker) as well as the proposed upzoning of the single family housing near this intersection the amount of commuter traffic that exits at this stop is heavy today and will continue to grow over time.      Safety  During peak travel times westbound vehicle traffic on SW Alaska backs up from the SW Alaska and Fauntleroy Way SW intersection back through the SW Alaska and 38th Ave SW intersection.  Vehicles often block the intersection which creates a safety issue for pedestrians trying to cross to the south side of the street.  Vehicles trying to pass through the intersection north-south on 38th Ave SW are also blocked and cause those sides of the intersection to back up as well.  It also creates a safety issue as there is a fire station on the southeast corner of the intersection.  Additionally, students that are in the walk zone to Fairmount Park Elementary also need to cross this intersection to get to school.",Create a market north-south crosswalk on the west side of the street.  SDOT should determine whether additional measures such as overhead signs or flashing beacons are also necessary,"47.561050, -122.380100",The intersection of SW Alaska and 38th Ave SW,Crossing Improvements,SDOT,"Pedestrians, Elementary school students, motoristsFire station",1,West Seattle
Not Feasible,0,19,9.5,,17-146 ,With 17-145,Improve crossing at Alaska Ave & 37th St,"It is dangerous to cross Alaska Ave at 37th.  Cars do not always see pedestrians.  Due to the proximity to the Y and other businesses in the Triangle, crossing at Fauntleroy or 35th is not as common as people crossing at 37th, and it can be risky.  ","A cross-walk with signage.  No light, just a crosswalk light up sign at most.  ","47.561060, -122.378790",37th Ave SW and Alaska,Crossing Improvements,SDOT,The community in the Fairmount Park area along with all the apartment dwellers that park in our neighborhood due to poor planning for parking at the aparments.  ,1,Fairmount Park
Not Feasible,0,15,7.5,,17-147,With 17-145,Improve crossing at Alaska Ave & 37th St,"Pedestrian safety at intersection of SW Alaska and 37th AVE SW.  With the new Rapid Ride bus lanes on Alaska and general increase in traffic due to all of the new housing (and yet to come housing) in the Alaska Junction, crossing Alaska is very difficult.  Now that the YMCA has been remodeled, there is an increasing number of pedestrians trying to cross SW Alaska.  Already there have been multiple vehicle accidents at this intersection and we should take action before a serious accident occurs.",Cross walk with flashing lights,"47.561060, -122.378790",intersection of 37th AVE SW and SW Alaska,Crossing Improvements,SDOT,Alaska Junction and nearby neighborhood residents will be able to safely cross SW Alaska St.,1,West Seattle
Funded for 2018 Implementation,18,16,17,,17-153,,Install crosswalk near Youngstown,Pedestrian overpass improvement / crosswalk installation,improve safety by slowing of traffic along residential road and providing better pedestrian access,"47.563916, -122.362869",Delridge Way SW - between Youngstown Cultural arts center and Delridge Playfield,Crossing Improvements,SDOT,"park users, pedestrians, residents",1,Delridge
Not Feasible,8,20,14,,17-163,,Traffic-calming on Avalon Way ,"Avalon is not a Truck route, yet trucks are the major traffic issue. There is only one light (at Genesee) and speeding is an issue with very few locations to cross the street in a residential zone. City has ignored request for speed study, blown off inquiries and replied 'there is nothing that can be done on that road'. Construction traffic at ALL hours through a residential neighborhood is disruptive. Bike lane is scary due to multiplex parking garage entrances. Street parking is at maximum capacity. Constant roar of traffic makes it undesirable to use Avalon as a pedestrian.","Traffic Calming plan would be a great start. Signs that say no Trucks and re-route to Fauntleroy (that is the primary Truck route) would be a start. Tree Planting for noise abatement and Parking plan, less micro and no parking property development, additional crossing and/or stop lights.","47.571420, -122.370710",Avalon Way - between Spokane and 35th,Traffic-Calming,SDOT,Neighborhood Residents,1,West Seattle - Fairmount
Did Not Advance,14,19,16.5,,17-181,,"Traffic-calming along Beacon Ave S, north and south of Bond St","Since the 1970s thrill seekers have sought out our segment of Beacon Ave S to ""jump the hump,"" a dangerous stunt where drivers speed down a 13% grade and launch into the air off a small dip in the road. Last February a teenaged driver doing this lost control of his vehicle, which careened, flipped and rolled twice before coming to rest upside down on the roadway trapping him and his 4 juvenile passengers inside.    There are no sidewalks on our segment of Beacon Ave S, which children walk along daily to catch the school bus. Aside from the elicit reckless driving, there is a general speeding problem from drivers bypassing 51st Ave S by using our neighborhood street as an arterial. The steep grades on either side of S Bond Street aggravate poor speed regulation even by local access drivers, and traffic calming measures are sorely needed.    Doppler radar data collected over an eight day period on Beacon Ave S 100 feet north of S Bond Street showed an 85th percentile of 34MPH and a 99th percentile of 43MPH. This means that fully 15% of the drivers on our road during this period broke the speed limit by at least 9MPH and 1% by at least 18MPH. The maximum speed recorded was 47MPH!    We are united as a neighborhood in a legitimate fear of being struck by speeding drivers on Beacon Ave S. Our pets have been their victims, they have been their own victims and it's only a matter of time until a bystander is injured or killed.","We believe speed humps on Beacon Ave S on either side of S Bond Street will effectively discourage speeding. Thrill seekers could then no longer ""jump the hump"" without serious damage to their vehicles, using our street as a bypass for 51st Ave S will no longer save time and local access drivers will develop better habits with the humps as a gentle reminder.","47.514290, -122.273770",The flat segments of Beacon Ave S north and south of S Bond Street,Traffic-Calming,SDOT,Our segment of Beacon Ave S is a popular walking and jogging destination due to the picturesque 18 acre horse farm along the east side of the road. Both immediate residents and those of the area at large will benefit from this traffic calming project due to increase in public safety.,2,Rainier Beach
Funded for 2018 Implementation,13,19,16,,17-190,,Install lighting along Henderson St,improve visibility at night along the sidewalks between the Link light rail station and nearby homes / businesses,augmenting lighting infrastructure,"47.523280, -122.279000",area along S Henderson St between MLK Way S and Renton Ave S,Lighting,SDOT,"pedestrians, residents, commuters",2,Rainier Beach
Funded for 2018 Implementation,16,14,15,,17-203,,Beautify Rose St. Triangle,"public beautification, possible CPTED to deter ""chronic dumping problem"" in the Rose ST triangle park","""Public art rehabilitiation""","47.529130, -122.269990","S Rose St ""Triangle Park""",Place-making/Beautification,SDOT,"park users, pedestrians, residents",2,Rainier Beach
Funded for 2018 Implementation,16,16,16,,17-676 ,With 17-679,"Improve crossing @ Corliss & 80th, near Greenlake","Cars speed down 80th making it difficult and dangerous to utilize poorly marked (but nonetheless maked) cross walks, not to mention cross 80th anywhere. Cuts off neighborhood access to Green Lake. ",Flashing crosswalk at 80th with a traffic calming device and well marked and painted (green?) cross walk. ,"47.686870, -122.330460",80th and Corliss,Crossing Improvements,SDOT,"Kids and walkers trying to get to and from Green Lake, shops along Green Lake, school (Bagley).  ",6,Green Lake
Not Feasible,12,19,15.5,,17-239,,Traffic-calming along Flora Ave S,"Georgetown has two small residential areas that are located between highways and arterial streets. In an effort to get around the traffic, many cars cut through the residential streets - at high speeds - careening around traffic circles and driving in very unsafe ways. Our residential, non-arterial streets have many people traveling on foot and bicycle and these cut-through drivers are a danger to us and themselves.",There are a total of 14 blocks of non-arterial residential streets in Georgetown. I am suggesting we add one speed bump to each of those blocks to slow traffic.,"47.546041, -122.319499","Flora Ave S, between E Marginal Way S and S Bailey St; Carleton Ave S, between E Marginal Way and S Bailey St; S Orcas street between Corson Ave S and 7th Ave S; S Homer St, between Corson Ave S and 7th Ave S",Traffic-Calming,SDOT,residents and visitors to Georgetown's residential areas; children who live in the neighborhood; drivers who should be driving more safely,2,Georgetown
Funded for 2018 Implementation,16,13,14.5,,17-262,,ADA ramps along 39th Ave S,"While there are generally sidewalks on 39th Ave S north of Aki Kurose Middle School between Orcas and Brandon for some reason the sidewalks are missing at most corners.  There is mud, grass, gravel and other surfaces that allow vehicles to take corners faster while making walking, stroller use and wheelchair use more challenging.  The intersections of 39th Ave S and Findlay, Lucile and Brandon need sidewalk corners paved including curb ramps.","The intersections of 39th Ave S and Findlay, Lucile and Brandon need sidewalk corners paved including curb ramps.","47.551960, -122.283450","The intersections of 39th Ave S and Findlay, Lucile and Brandon",Accessibility Improvements,SDOT,"Students of nearby schools (Aki Kurose, St. Edward's and others), elderly and wheelchair user neighbors, visitors and neighbors.",2,Hillman City 
"On Ballot, Not Funded",14,16,15,,17-263,,Improve 15th Ave S and Angeline Crossing,"Four amazing Mid-Beacon schools are along a mile stretch on 15th Ave SW. They are Asa Mercer, Maple Elementary, St. George Parish School, and Cleveland High School. Unfortunately, the traffic has gotten so terrible that our children, bicyclists, teachers, parents, and neighbors are forced to risk life and limb daily trying to get from the East side of the street to the West, where three of the four school are located. There are only 2 legitimate crossing locations in that mile stretch, otherwise it's Frogger for All! Coupled with the traffic trying to get on the quick I5 exits, this is a recipe for disaster! We need help! ","School colors painted on each street crossing that leads to the school, as well as way-making signs with each school name and cross walk lights. (Dream big!) This shows both school and neighborhood pride for an entire community!","47.552299, -122.313904","From Asa Mercer Middle School to Cleveland High School, a .9 mile route along 15th Ave S",Place-making/Beautification,SDOT,"All of Beacon Hill, and all of those traveling through it to pick up kids, drop off kids, and traveling in our beautiful neighborhood. ",2,Beacon Hill
"On Ballot, Not Funded",16,,16,,17-266,With 17-263,Traffic-calming and safe crossings along 15th Ave S,"We have 4 schools within less than a mile of one another, all connected by 15th Ave S. There is Asa Mercer Middle School, Maple Elementary School, St. George Parish School, and Cleveland High School. Due to the proximity to an I5 exit and entrance, and the lack of stop lights and signs, this has been an enormous safety issue for the children walking to school, as well as the traffic driving children to and from their respective schools. The crosswalks are not lit, and in fact, are not available. ","There are three major problems.   1) Make crosswalks that people can use to safely go from the East side of 15th to the West.  2) Slow the traffic coming through, and alleviate the back-up of school pick-ups and drop-offs.  3) Bring together each of these communities to share in the protection of all that walk, ride, or drive in this neighborhood. ","47.553430, -122.313470","From Asa Mercer Middle School to Cleveland High School, a .9 mile route along 15th Ave S",School Safety,SDOT,All 4 schools and all of the surrounding community.,2,Beacon Hill
Not Feasible,17,10,13.5,,17-300,,Traffic Calming along Dakota St,The intersection at 38th Ave S and Dakota is very dangerous.  38th ave s. is an arterial from Spokane to Genesee with no traffic calming along the .5 mile route.  This corner is a very popular crossing for students walking to Hawthorne Elementary (2 blocks east of 38th ave s.).   I watch everyday as cars blast through the intersection without stopping for students waiting patiently for kids to cross the street.  It is an accident waiting to happen! ,Flashing beacon for the crosswalk at 38th ave s. and Dakota. Or a traffic circle.  But the flashing beacon is probably most realistic as the street is an arterial. ,"47.566235, -122.285000",38th ave s. and dakota.,Crossing Improvements,SDOT,"Students walking to Hawthorne Elementary, and the greater community. ",2,Mt. Baker
"On Ballot, Not Funded",15,15,15,,17-319,,Add a verbal crossing notification to S. Beacon Ave & 15th Ave S,Visually impaired persons cannot cross Beacon & 15th Ave intersection safely,Add a verbal crossing notification to S. Beacon Ave & 15th Ave S,"47.580942, -122.313604",15th Ave S & Beacon Ave,Accessibility Improvements,SDOT,,2,Beacon Hill
Not Feasible,17,20,18.5,,17-334,,Install streetlights and stop signs @ Jackson & 10th Ave S.,street lights/stop signs - traffic is getting busiers and it's already a busy intersection.   Don't wait until somebody is hurt until it happens.  ,"Purchasing lights, shutting down traffic for a night -  install street lights and stop signs. ","47.59921, -122.31964",10th & Jackson in the ID ,Crossing Improvements,SDOT,Everyone -- pedestrians and drivers. ,2,Chinatown/ID
"On Ballot, Not Funded",20,20,20,,17-338,,ADA improvements to 2nd Ave Ext S and S Jackson intersection,"The crossing for 2nd Ave Ext S at S Jackson St is inaccessible and confusing, especially if you have a visual impairment. Many visually impaired travelers commute through this area to get to Bus Stop 1778. The intersection is particularly challenging due the angle of the streets and the heavy volume of left turners on SB 2nd Ave Ext S. If one cannot see the pedestrian crossing lights, the audible cues of the traffic are difficult to decipher and one can often hear the audible signal from the 4th and Jackson intersection. If a person is not familiar with the intersection, they may confuse the audible signal from 4th and Jackson for this intersection and step into traffic.  ",Add an APS with a different audible tone than the APS at the 4th and Jackson intersection. ,"47.599210, -122.329700",Intersection of 2nd Ave Ext S and S Jackson St. ,Accessibility Improvements,SDOT,"All commuters, especially those with visual impairments",7,Chinatown/ID
"On Ballot, Not Funded",18,17,17.5,,17-347,,Restructure corner & add ADA improvements to 25th Ave S & Plum St,"The intersection of S Plum Street and 25th Ave South has been the site of a variety of accidents, including residential drivers, Metro drivers, and school buses - and many undocumented near misses, some including pedestrians. Due to the elevation gain on the approach to the intersection from the west and property height at the NW and SW corners a driver’s view of other approaching vehicles is impaired at this Two-Way Stop intersection. The NE corner is taken up  by diagonal parking, which at times includes large vans or trucks that completely block the visual access of drivers traveling south on 25th of vehicles approaching from the east. This street is commonly used by drivers seeking a “short cut” between Rainier or 23rd and MLK Way - often these drivers are in a hurry and speeding. This intersection is directly adjacent to the Lighthouse for the Blind, Inc. and the American red Cross. Both business have many employees and visitors that are traveling through this intersection, both on foot and by vehicle.      ","By creating a formal corner with ADA approved accessible ramps at the NE corner where one currently does not exist, it will eliminate several parking spaces that obscure the visual angle of drivers watching for cross traffic opening up the intersection for greater pedestrian and vehicular safety.  It would move the intersection forward in improving the overall design of the intersection for pedestrians and drivers while sacrificing only a few parking spaces that should not be there. There is ample parking at the nearby organizations and many free street parking spaces.   Another step towards making the intersection as safe as possible would be to make it a Four-way stop intersection instead of a Two-way stop. This would prevent short-cutting drivers from speeding through the intersection and potentially causing accidents.   ","47.585470, -122.300320",The NE corner of the intersection of 25th Ave South and South Plum Street.,Accessibility Improvements,SDOT,"Employees commuting to the Lighthouse for the Blind, Inc. located on the SE corner of the intersection, employees and visitors to the Red Cross on the NE corner of the intersection, residents and visitors to the neighborhood, including those who may be traveling to the nearby section of the Mountains-to-Sound Greenway, and the employees and many visitors to the 2100 Building (1 block away). The 2100 building is home to 12 non-profits that focus on working with children in the community - children and teens are often traveling through the neighborhood to attend programming.",3,North Rainier
